{
  "$schema": "https://json-schema.org/draft/2020-12/schema",
  "type": "object",
  "properties": {
    "name": {
      "description": "String / Text Component of Game",
      "$ref": "./properties/text.schema.json"
    },
    "subtitle": {
      "$ref": "./properties/text.schema.json"
    },
    "icon": {
      "type": "string"
    },
    "intro_slideshow": {
      "type": "string"
    },
    "backend_id": {
      "type": "string"
    },
    "statistics_key": {
      "type": "string"
    },
    "minimum_participants": {
      "type": "integer",
      "minimum": 1
    },
    "maximum_participants": {
      "type": "integer"
    },
    "is_multi_game": {
      "type": "boolean"
    },
    "hide_from_list": {
      "type": "boolean"
    },
    "waiting": {
      "type": "object",
      "properties": {
        "map": {
          "$ref": "./properties/map.schema.json"
        },
        "behaviors": {
          "$ref": "./behaviors/behaviors.schema.json"
        }
      },
      "required": [
        "map",
        "behaviors"
      ]
    },
    "map": {
      "$ref": "./properties/map.schema.json"
    },
    "behaviors": {
      "$ref": "./behaviors/behaviors.schema.json"
    }
  },
  "required": [
    "name",
    "map",
    "behaviors"
  ]
}
