{
  "name": {
    "translate": "ltminigames.minigame.escape_race",
    "color": "gold",
    "extra": [
      " ",
      {
        "translate": "ltminigames.minigame.teams_2",
        "color": "gold"
      }
    ]
  },
  "minimum_participants": 1,
  "maximum_participants": 6,
  "hide_from_list": true,
  "is_multi_game": true,
  "waiting": {
    "map": {
      "type": "ltminigames:load_map",
      "load_from": "lt:games/waiting_lobby",
      "dimension_type": "tropicraft:tropics"
    },
    "behaviors": [
      {
        "type": "lt:common/waiting",
        "regions": {
          "spawn": "spawn"
        }
      },
      {
        "type": "ltminigames:setup_teams",
        "teams": {
          "blue": {
            "name": {
              "translate": "ltminigames.minigame.teams.blue"
            },
            "dye": "blue",
            "assign_roles": ["river_race_blue"]
          },
          "red": {
            "name": {
              "translate": "ltminigames.minigame.teams.red"
            },
            "dye": "red",
            "assign_roles": ["river_race_red"]
          }
        }
      }
    ]
  },
  "map": {
    "type": "ltminigames:load_map",
    "load_from": "lt:games/escape_race/escape_race_warehouse",
    "dimension_type": "lt:raised_clouds"
  },
  "behaviors": "lt:escape_race/warehouse/main"
}
