{
  "name": {
    "translate": "ltminigames.minigame.levitation",
    "color": "dark_green"
  },
  "minimum_participants": 1,
  "maximum_participants": 1000,
  "map": {
    "type": "ltminigames:load_map",
    "load_from": "lt:games/levitation"
  },
  "behaviors": [
    {
      "type": "lt:common/playing",
      "game_type": "adventure",
      "join_late_with_role": "spectator",
      "statistics_key": "levitation"
    },
    {
      "type": "ltminigames:position_players",
      "participants": "spawn",
      "spectators": "end"
    },
    {
      "type": "ltminigames:progression",
      "named_points": {
        "start": 0,
        "rise": 10
      }
    },
    {
      "type": "ltminigames:scheduled_actions",
      "actions": {
        "rise": {
          "type": "ltminigames:set_blocks",
          "replace": {
            "blocks": [
              "minecraft:light_blue_stained_glass"
            ]
          },
          "set": "minecraft:air",
          "region": "barrier"
        }
      }
    },
    {
      "type": "ltminigames:events",
      "events": {
        "player_participate": [
          {
            "type": "ltminigames:give_effect",
            "effects": [
              {
                "type": "minecraft:levitation",
                "seconds": 100000,
                "amplifier": 1,
                "particles": false,
                "show_icon": false
              }
            ]
          },
          {
            "type": "ltminigames:run_commands",
            "entity": "tag @s add levitation.yes"
          }
        ],
        "player_remove": {
          "type": "ltminigames:run_commands",
          "entity": "tag @s remove levitation.yes"
        }
      }
    },
    {
      "type": "ltminigames:phase_triggers/stop",
      "actions": {
        "type": "ltminigames:run_commands",
        "regions": {
          "end": [
            "kill @e[current_world\u003dtrue,type\u003dminecraft:fishing_bobber]"
          ]
        }
      }
    },
    {
      "type": "ltminigames:while_in_region",
      "regions": {
        "end": [
          {
            "type": "ltminigames:run_commands",
            "entity": [
              "tellraw @a[tag\u003dlevitation.yes] [{\"selector\":\"@s\",\"extra\":[{\"text\":\" has won the game!\"}]}]",
              "kill @e[current_world\u003dtrue,type\u003dminecraft:fishing_bobber]"
            ]
          },
          "ltminigames:close_game"
        ]
      },
      "interval": 5
    },
    {
      "type": "ltminigames:set_role",
      "role": "participant",
      "actions": {
        "type": "ltminigames:add_equipment",
        "items": [
          {
            "id": "minecraft:fishing_rod",
            "components": {
              "unbreakable": {},
              "ltextras:undroppable": {}
            }
          }
        ]
      }
    },
    "ltminigames:disable_hunger",
    {
      "type": "ltminigames:set_game_rules",
      "rules": {
        "minecraft:command_blocks_work": false,
        "minecraft:locator_bar": false,
        "minecraft:spawn_mobs": false,
        "minecraft:immediate_respawn": true,
        "minecraft:advance_weather": false,
        "minecraft:fall_damage": false,
        "minecraft:advance_time": false,
        "minecraft:show_advancement_messages": false
      }
    },
    {
      "type": "ltminigames:cancel_player_damage",
      "knockback": true
    },
    "ltminigames:immediate_respawn",
    "lt:common/spectator",
    {
      "type": "ltminigames:scheduled_actions",
      "target": "all_players",
      "actions": {
        "1": {
          "type": "ltminigames:send_message",
          "message": {
            "translate": "ltminigames.minigame.levitation.intro1",
            "color": "green",
            "italic": true
          }
        },
        "4": {
          "type": "ltminigames:send_message",
          "message": {
            "translate": "ltminigames.minigame.levitation.intro2",
            "color": "gray",
            "italic": true
          }
        }
      }
    },
    {
      "type": "lt:fixed_rewards",
      "coins": 5
    }
  ]
}
