{
  "name": {
    "translate": "ltminigames.minigame.turtle_race"
  },
  "subtitle": "Standard 2 Lap - LT21",
  "icon": "ltminigames:minigames/turtle_race/turtle_icon_1",
  "statistics_key": "race_standard_21",
  "backend_id": "lt:turtle_race",
  "map": {
    "type": "ltminigames:load_map",
    "load_from": "lt:turtle_race_21",
    "dimension_type": "tropicraft:tropics"
  },
  "waiting": {
    "map": {
      "type": "ltminigames:load_map",
      "load_from": "lt:waiting_lobby",
      "dimension_type": "tropicraft:tropics"
    },
    "behaviors": [
      {
        "type": "lt:common/waiting",
        "regions": {"spawn": "spawn"}
      }
    ]
  },
  "minimum_participants": 4,
  "maximum_participants": 1000,
  "behaviors": [
    {
      "type": "lt:turtle_race/standard",
      "track_point_count": 130,
      "lap_count": 2
    }
  ]
}
