{
  "name": {
    "translate": "ltminigames.minigame.columns_of_chaos",
    "color": "dark_green"
  },
  "minimum_participants": 1,
  "maximum_participants": 1000,
  "map": {
    "type": "ltminigames:load_map",
    "load_from": "lt:games/pillars_of_wealth"
  },
  "waiting": {
    "map": {
      "type": "ltminigames:load_map",
      "load_from": "lt:games/waiting_lobby",
      "dimension_type": "tropicraft:tropics"
    },
    "behaviors": [
      {
        "type": "lt:common/waiting",
        "regions": {
          "spawn": "spawn"
        }
      }
    ]
  },
  "behaviors": [
    {
      "type": "lt:common/playing",
      "game_type": "survival",
      "join_late_with_role": "spectator",
      "statistics_key": "columns_of_chaos"
    },
    {
      "type": "lt:columns_of_chaos/common",
      "team_based": false
    },
    {
      "type": "lt:columns_of_chaos/phases",
      "total_seconds": 600
    }
  ]
}
