{
  "name": {"translate": "ltminigames.minigame.turtle_race"},
  "icon": "ltminigames:textures/gui/minigames/turtle_race/turtle_icon_1.png",

  "statistics_key": "turtle_race",
  "map": {
    "type": "ltminigames:inline",
    "dimension": "tropicraft:tropics"
  },
  "minimum_participants": 1,
  "maximum_participants": 10,
  "behaviors": [
    {
      "type": "ltminigames:set_game_types",
      "participant": "adventure",
      "spectator": "spectator"
    },
    {
      "type": "ltminigames:commands",
      "ready": "scoreboard players set Mode TRaceGlobal 1",
      "start": "function lt:minigames/turtle_race/begin",
      "player_join": "function lt:minigames/turtle_race/player/join",
      "cancel": "function lt:minigames/turtle_race/cancel"
    },
    "ltminigames:spectator_chase",
    {
      "type": "ltminigames:bind_objective_to_statistic",
      "objectives": {
        "placement": "TRacePlayerPlace",
        "total_time": "TRacePlayerS"
      }
    }
  ]
}
