{
  "name": {"translate": "ltminigames.minigame.block_party"},

  "statistics_key": "block_party",
  "map": {
    "type": "ltminigames:load_map",
    "load_from": "lt:block_party"
  },
  "minimum_participants": 1,
  "maximum_participants": 32,
  "behaviors": [
    {
      "type": "lt:common/playing",
      "game_type": "adventure",
      "join_late_with_role": "spectator"
    },
   "ltminigames:last_remaining_win_trigger",
    {
      "type": "ltminigames:block_party",
      "floor": "blocks",
      "blocks": [
        "minecraft:red_mushroom_block",
        "minecraft:shroomlight",
        "ltextras:imposter_horn_coral_block",
        "minecraft:melon",
        "minecraft:warped_wart_block",
        "minecraft:blue_ice",
        "ltextras:imposter_tube_coral_block",
        "ltextras:imposter_bubble_coral_block",
        {
          "Name": "minecraft:cherry_leaves",
          "Properties": {
            "persistent": "true"
          }
        }
      ],
      "quad_size": 3,
      "max_time": 280,
      "time_decay_rounds": 10,
      "interval": 80,
      "knockback_after_round": 5
    },
    {
      "type": "ltminigames:set_game_rules",
      "rules": {
        "doDaylightCycle": "false",
        "doWeatherCycle": "false",
        "doMobSpawning": "false",
        "fallDamage": "false",
        "announceAdvancements": "false",
        "doImmediateRespawn": "true"
      }
    },
    "ltminigames:disable_hunger",
    "ltminigames:spectator_chase",
    "ltminigames:disable_throwing_items",
    "lt:common/announce_game_over",
    {
      "type": "ltminigames:game_finish",
      "actions": {
        "type": "ltminigames:apply_to_player",
        "target": "all",
        "actions": {
          "type": "ltminigames:give_reward",
          "items": ["ltextras:tropicoin"],
          "statistic_binding": {
            "statistic": "rounds_survived"
          }
        }
      }
    }
  ]
}
