{
  "name": {
    "translate": "Crab Racing",
    "color": "dark_green"
  },
  "icon": "ltminigames:minigames/turtle_race/turtle_icon_1",
  "maximum_participants": 50,
  "map": {
    "type": "ltminigames:load_map",
    "load_from": "lt:games/mysty/racing/iceboat",
    "dimension_type": "tropicraft:tropics"
  },
  "behaviors": "lt:crab_race/game"
}
