{
  "name": {
    "translate": "ltminigames.minigame.escape_race.room_1",
    "color": "dark_green"
  },
  "hide_from_list": true,
  "maximum_participants": 1000,
  "map": {
    "type": "ltminigames:load_map",
    "load_from": "lt:escape_race_room_1",
    "dimension_type": "lt:raised_clouds"
  },
  "waiting": {
    "map": {
      "type": "ltminigames:load_map",
      "load_from": "lt:waiting_lobby",
      "dimension_type": "tropicraft:tropics"
    },
    "behaviors": [
      {
        "type": "lt:common/waiting",
        "regions": {
          "spawn": "spawn"
        }
      },
      "lt:escape_race/one_team"
    ]
  },
  "behaviors": [
    {
      "type": "lt:common/playing",
      "game_type": "adventure",
      "join_late_with_role": "spectator",
      "allow_rejoin": true
    },
    {
      "type": "lt:escape_race/rooms/1/common_1"
    }
  ]
}
