{
  "waiting": {
    "map": {
      "type": "ltminigames:load_map",
      "load_from": "lt:waiting_lobby",
      "dimension_type": "tropicraft:tropics"
    },
    "behaviors": [
      {
        "type": "lt:common/waiting",
        "regions": {
          "spawn": "spawn"
        }
      },
      "lt:teams/red_blue"
    ]
  },

  "name": {"translate": "ltminigames.minigame.columns_of_chaos_teams_endless"},
  "statistics_key": "columns_of_chaos",
  "map": {
    "type": "ltminigames:load_map",
    "load_from": "lt:pillars_of_wealth"
  },
  "minimum_participants": 1,
  "maximum_participants": 30,
  "behaviors": [
    {
      "type": "lt:common/playing",
      "game_type": "survival",
      "join_late_with_role": "spectator"
    },
    "ltminigames:teams",
    "lt:columns_of_chaos/common"
  ]
}
