{
  "name": {
    "translate": "ltminigames.minigame.survive_the_tide_3",
    "color": "blue"
  },
  "subtitle": {
    "translate": "ltminigames.minigame.low",
    "color": "red"
  },
  "icon": "ltminigames:minigames/survive_the_tide/icon",
  "intro_slideshow": "lt:game/survive_the_tide/ffa_3",
  "minimum_participants": 3,
  "maximum_participants": 1000,
  "waiting": {
    "map": {
      "type": "ltminigames:load_map",
      "load_from": "lt:games/waiting_lobby",
      "dimension_type": "tropicraft:tropics"
    },
    "behaviors": [
      {
        "type": "lt:common/waiting",
        "regions": {
          "spawn": "spawn"
        }
      }
    ]
  },
  "map": {
    "type": "ltminigames:load_map",
    "load_from": "lt:games/survive_the_tide/survive_the_tide_3",
    "dimension_type": "lt:raised_clouds"
  },
  "behaviors": [
    {
      "type": "lt:common/playing",
      "game_type": "adventure",
      "join_late_with_role": "spectator",
      "backend_id": "lt:survive_the_tide_3",
      "statistics_key": "survive_the_tide"
    },
    {
      "type": "lt:survive_the_tide/3/map",
      "tide": 180
    },
    "lt:survive_the_tide/3/phases",
    "lt:survive_the_tide/mode/ffa",
    "lt:survive_the_tide/3/weather",
    "lt:survive_the_tide/common"
  ]
}
