{
  "name": {"translate": "ltminigames.minigame.survive_the_tide_2"},
  "subtitle": "Kevin & RTGame",

  "statistics_key": "survive_the_tide",
  "backend_id": "lt:survive_the_tide_2_teams",

  "minimum_participants": 3,
  "maximum_participants": 24,
  "waiting": {
    "map": {
      "type": "ltminigames:load_map",
      "load_from": "lt:waiting_lobby",
      "dimension_type": "tropicraft:tropics"
    },
    "behaviors": [
      {
        "type": "lt:common/waiting",
        "regions": {
          "spawn": "spawn"
        }
      },
      {
        "type": "ltminigames:setup_teams",
        "teams": [
          {
            "key": "the_duo",
            "name": "The Duo",
            "dye": "red",
            "text": "red",
            "assign": [
              "3e6835f1-7344-435a-9a23-c2f2441a002c",
              "dce7b3a1-6f05-41a6-91cd-71c34de5b801"
            ]
          },
          {
            "key": "the_viewers",
            "name": "The Viewers",
            "dye": "aqua",
            "text": "aqua"
          }
        ]
      }
    ]
  },
  "map": {
    "type": "ltminigames:load_map",
    "load_from": "lt:survive_the_tide_2"
  },
  "behaviors": [
    {
      "type": "lt:common/playing",
      "game_type": "adventure",
      "join_as_role": "spectator"
    },
    "ltminigames:teams",
    {"type": "ltminigames:set_max_health", "max_health_by_team": {"the_viewers": 6.0}},
    "lt:survive_the_tide/stt2_map",
    "lt:survive_the_tide/stt2_phases",
    "lt:survive_the_tide/intro",
    "lt:survive_the_tide/ruleset",
    "lt:survive_the_tide/teams_win_logic",
    "lt:survive_the_tide/weather_stt2",
    "lt:survive_the_tide/stream_integrations",
    "lt:survive_the_tide/common"
  ]
}
