{
  "name": {
    "translate": "ltminigames.minigame.speed_carb_golf",
    "color": "dark_green",
    "extra": [
      " ",
      {
        "translate": "ltminigames.minigame.teams_2",
        "color": "gold"
      }
    ]
  },
  "minimum_participants": 1,
  "maximum_participants": 1000,
  "hide_from_list": false,
  "waiting": {
    "map": {
      "type": "ltminigames:load_map",
      "load_from": "lt:games/waiting_lobby",
      "dimension_type": "tropicraft:tropics"
    },
    "behaviors": [
      {
        "type": "lt:common/waiting",
        "regions": {
          "spawn": "spawn"
        }
      },
      "lt:teams/red_blue"
    ]
  },
  "map": {
    "type": "ltminigames:load_map",
    "load_from": "lt:games/speed_carb_golf"
  },
  "behaviors": [
    {
      "type": "lt:common/playing",
      "game_type": "adventure",
      "join_late_with_role": "spectator",
      "allow_rejoin": true,
      "statistics_key": "speed_carb_golf"
    },
    "ltminigames:teams",
    "lt:speed_carb_golf/common"
  ]
}
