{
  "name": {"translate": "ltminigames.minigame.survive_the_tide_2"},
  "subtitle": "3 Teams",
  "icon": "ltminigames:textures/gui/minigames/survive_the_tide/icon.png",

  "statistics_key": "survive_the_tide",
  "backend_id": "lt:survive_the_tide_2_teams",

  "minimum_participants": 3,
  "maximum_participants": 40,
  "waiting": {
    "map": {
      "type": "ltminigames:load_map",
      "load_from": "lt:waiting_lobby",
      "dimension_type": "tropicraft:tropics"
    },
    "behaviors": [
      {
        "type": "lt:common/waiting",
        "regions": {
          "spawn": "spawn"
        }
      },
      "lt:teams/red_blue_yellow"
    ]
  },
  "map": {
    "type": "ltminigames:load_map",
    "load_from": "lt:survive_the_tide_2"
  },
  "behaviors": [
    {
      "type": "lt:common/playing",
      "game_type": "adventure",
      "join_late_with_role": "spectator"
    },
    "ltminigames:teams",
    "lt:survive_the_tide/stt2_map",
    "lt:survive_the_tide/stt2_phases",
    "lt:survive_the_tide/intro",
    "lt:survive_the_tide/ruleset",
    "lt:survive_the_tide/teams_win_logic",
    "lt:survive_the_tide/teams_glow_members",
    "lt:survive_the_tide/weather_stt2",
    "lt:survive_the_tide/stream_integrations",
    "lt:survive_the_tide/common"
  ]
}
